Domain,Cause,Effect,Context,Shuffled
Eco&fin,Central bank raises interest rates,Consumer borrowing decreases,Consumer borrowing decreases when the central bank raises interest rates because loans become more expensive.,0
Eco&fin,Introduction of algorithmic trading strategies,Increased volatility in financial markets,Financial markets often swing more sharply after trading firms introduce algorithmic trading strategies because rapid automated orders amplify price moves.,0
Eco&fin,Tightening regulations on cryptocurrency exchanges,Reduced market liquidity,Market liquidity falls when regulators tighten rules on cryptocurrency exchanges since stricter compliance discourages active trading.,0
Eco&fin,Increased international trade tariffs,Reduction in import-dependent industries' profitability,Import‑dependent industries earn less profit when international trade tariffs rise because their input costs climb.,0
Eco&fin,"Rise in ESG (Environmental, Social, Governance) investing standards",Growth in sustainable investment funds,Sustainable investment funds expand as ESG standards rise because investors prefer responsible portfolios.,0
Eco&fin,Implementation of remote work policies,Reduced corporate real estate expenditures,Companies spend less on offices after they introduce remote work policies because fewer staff need desks.,0
Eco&fin,Enhanced data privacy legislation,Increased compliance costs for businesses,Compliance costs rise for businesses when data privacy legislation is enhanced because they must update systems.,0
Eco&fin,Adoption of central bank digital currencies (CBDCs),Decline in traditional cash usage,Traditional cash usage drops as central banks issue digital currencies making electronic payments routine.,0
Eco&fin,Escalation of geopolitical tensions,Increased prices of commodities such as oil,Commodity prices like oil rise when geopolitical tensions escalate because traders fear supply shocks.,0
Eco&fin,Rising inflation rates,Decrease in consumer purchasing power,Consumer purchasing power falls as inflation rises because prices outpace wages.,0
Eco&fin,Expansion of financial literacy education,Increased household savings rates,Household saving rates increase when people receive financial literacy education because they learn to plan budgets.,0
Eco&fin,Growth of fintech lending platforms,Improved access to credit for small businesses,Small businesses get better credit access when fintech lending platforms grow because online lenders use alternative data.,0
Eco&fin,Sudden bankruptcy of major banks,Decline in investor confidence,Investor confidence declines if a major bank suddenly collapses because contagion worries spread.,0
Eco&fin,Increased automation in financial auditing,Reduction in accounting errors,Accounting errors drop when firms automate financial audits because software checks figures consistently.,0
Eco&fin,Reduction in government subsidies for renewable energy,Decreased private investment in solar power projects,Investment in solar projects falls when governments cut renewable energy subsidies because returns diminish.,0
Eco&fin,Surge in remote banking services,Decline in physical bank branch numbers,Bank branches close more often as remote banking services surge because clients transact online.,0
Eco&fin,Implementation of carbon taxes,Increased operational costs for heavy industries,Heavy industries face higher operating costs after carbon taxes are implemented because emissions incur fees.,0
Eco&fin,Adoption of AI‑driven credit scoring,Increased accuracy in loan approvals,Loan approval accuracy improves when lenders adopt AI‑driven credit scoring because models analyze rich data.,0
Eco&fin,Supply chain disruptions due to pandemics,Inflationary pressures on consumer goods,Pandemic‑related supply chain disruptions drive up consumer goods prices causing inflationary pressure.,0
Eco&fin,Expanded use of blockchain in supply chain finance,Improved transparency in transactions,Transaction transparency grows in supply chain finance when blockchain is adopted because every step is recorded.,0
Eco&fin,Rise in housing market speculation,Increased risk of property price bubbles,Property price bubbles become likelier when housing speculation rises because rapid buying inflates values.,0
Eco&fin,Reduction of foreign direct investment due to economic sanctions,Slowed economic growth,Economic growth slows when foreign direct investment falls due to sanctions because capital inflows shrink.,0
Eco&fin,Increased corporate mergers and acquisitions,Reduction in market competition,Market competition diminishes as mergers and acquisitions increase because big firms absorb rivals.,0
Eco&fin,Strengthened anti‑money laundering policies,Increased administrative overhead for banks,Administrative overhead rises for banks when anti‑money‑laundering policies are strengthened because screening processes expand.,0
Eco&fin,Shift towards digital payment systems,Reduced circulation of physical currency,Physical currency circulates less as people shift to digital payments because electronic methods are easier.,0
Env&clim,Increased frequency of forest fires,Reduction in biodiversity,"The increased frequency of forest fires destroyed many habitats, so biodiversity declined.",0
Env&clim,Expansion of urban areas,Loss of wetlands,"As urban areas expanded, many wetlands were drained and lost to make room for buildings.",0
Env&clim,Rapid ocean acidification,Decreased coral reef resilience,"Rapid ocean acidification weakened coral skeletons, so coral reefs became less resilient to stress.",0
Env&clim,Adoption of regenerative agriculture practices,Increased soil carbon sequestration,"By adopting regenerative agriculture practices, farmers improved soil health and increased carbon sequestration in soils.",0
Env&clim,Extensive deforestation in tropical regions,Reduction in regional rainfall,"Extensive deforestation in tropical regions reduced evapotranspiration, leading to lower regional rainfall.",0
Env&clim,Increased microplastic pollution,Decline in marine life populations,"As microplastic pollution increased, marine life ingested plastics and populations began to decline.",0
Env&clim,Widespread drought conditions,Reduced agricultural productivity,"Widespread drought conditions dried out crops and soils, so agricultural productivity fell.",0
Env&clim,Intensified hurricane activity,Increased coastal infrastructure damage,"Intensified hurricane activity brought stronger winds and storm surges, causing more damage to coastal infrastructure.",0
Env&clim,Melting permafrost in polar regions,Increased methane release,"Melting permafrost in polar regions released trapped methane into the atmosphere, increasing greenhouse gas emissions.",0
Env&clim,Implementation of plastic bag bans,Reduction in plastic waste,"Since plastic bag bans were implemented, plastic waste in landfills and waterways has decreased.",0
Env&clim,Adoption of electric vehicles,Reduction in urban air pollution,"As more people adopted electric vehicles, harmful exhaust emissions fell and urban air pollution decreased.",0
Env&clim,Rising global average temperatures,Increased frequency of heatwaves,Rising global average temperatures made heatwaves more frequent and severe.,0
Env&clim,Extensive fertilizer runoff,Increased eutrophication in aquatic ecosystems,"Extensive fertilizer runoff released excess nutrients into water bodies, increasing eutrophication and algae blooms.",0
Env&clim,Enhanced public transportation infrastructure,Reduced urban greenhouse gas emissions,"Enhanced public transportation infrastructure encouraged people to use buses and trains, reducing urban greenhouse gas emissions.",0
Env&clim,Rapid glacial retreat in mountainous regions,Reduced freshwater availability,"Rapid glacial retreat in mountainous regions lowered glacier meltwater, reducing freshwater availability for communities downstream.",0
Env&clim,Expansion of offshore wind farms,Increased renewable energy production,"The expansion of offshore wind farms added more turbines at sea, increasing renewable energy production.",0
Env&clim,Increased urban heat islands due to construction,Elevated energy consumption for cooling,"Increased urban heat islands from new construction raised temperatures, so buildings used more energy for cooling.",0
Env&clim,Development of large-scale solar farms,Habitat disruption for wildlife,"The development of large-scale solar farms cleared land and disrupted habitats, affecting local wildlife.",0
Env&clim,Severe soil erosion due to intensive agriculture,Reduced land productivity,"Severe soil erosion from intensive agriculture washed away topsoil, reducing the land’s productivity.",0
Env&clim,Adoption of stringent emissions regulations,Reduction in industrial pollution,"With the adoption of stringent emissions regulations, industries cut pollutant outputs and industrial pollution fell.",0
Env&clim,Increased desalination plant operations,Increased brine discharge impacting marine ecosystems,"As desalination plant operations increased, the higher brine discharge harmed marine ecosystems near the outflow sites.",0
Env&clim,Increased prevalence of invasive species due to global trade,Loss of native species,"Global trade brought in invasive species that outcompeted locals, causing losses of native species.",0
Env&clim,Expansion of protected marine reserves,Recovery of fish populations,"The expansion of protected marine reserves gave fish safe areas to breed and recover, boosting their populations.",0
Env&clim,Implementation of urban tree planting programs,Mitigation of urban air pollution,"Urban tree planting programs added more trees to city streets, which helped filter pollutants and mitigate air pollution.",0
Env&clim,Rapid melting of Antarctic ice shelves,Acceleration of global sea-level rise,"The rapid melting of Antarctic ice shelves added more water to the ocean, accelerating global sea-level rise.",0
Tech&cs,Adoption of quantum computing algorithms,Enhanced computational speeds for cryptographic analysis,Adoption of quantum computing algorithms lets systems perform cryptographic analysis at much faster speeds.,0
Tech&cs,Increased use of machine learning in healthcare diagnostics,Improved accuracy in disease detection,Healthcare providers use more machine learning in diagnostics so disease detection becomes more accurate.,0
Tech&cs,Widespread adoption of IoT (Internet of Things) devices,Increased vulnerability to cyberattacks,The widespread adoption of IoT (Internet of Things) devices increases vulnerability to cyberattacks.,0
Tech&cs,Growth in remote work technology adoption,Increased demand for cybersecurity solutions,Growth in remote work technology adoption drives higher demand for cybersecurity solutions.,0
Tech&cs,Development of 5G infrastructure,Reduced latency in wireless communication,Development of 5G infrastructure reduces latency in wireless communication.,0
Tech&cs,Increased application of facial recognition technologies,Heightened privacy concerns,Increased application of facial recognition technologies raises privacy concerns among users.,0
Tech&cs,Implementation of edge computing,Reduced data transmission latency,Implementation of edge computing reduces data transmission latency by processing data closer to end devices.,0
Tech&cs,Adoption of software-defined networking (SDN),Increased flexibility in network management,The Adoption of software-defined networking (SDN) leads to a Increased flexibility in network management.,1
Tech&cs,Expanded use of augmented reality (AR) in retail,Enhanced customer engagement,Expanded use of augmented reality (AR) in retail enhances customer engagement through interactive experiences.,0
Tech&cs,Adoption of generative AI models,Increased productivity in content creation,Adoption of generative AI models increases productivity in content creation by automating routine writing tasks.,0
Tech&cs,Increased use of blockchain in supply chain management,Improved tracking of goods,Increased use of blockchain in supply chain management improves tracking of goods at each step of delivery.,0
Tech&cs,Development of neuromorphic computing chips,Increased efficiency in artificial intelligence processing,Development of neuromorphic computing chips increases efficiency in artificial intelligence processing by mimicking neural networks.,0
Tech&cs,Expansion of satellite-based internet services,Improved connectivity in rural areas,Expansion of satellite-based internet services improves connectivity in rural areas that lack traditional networks.,0
Tech&cs,Widespread deployment of biometric authentication,Increased user account security,Widespread deployment of biometric authentication increases user account security with unique physical identifiers.,0
Tech&cs,Enhanced predictive analytics capabilities,Improved supply chain resilience,Enhanced predictive analytics capabilities improve supply chain resilience by forecasting demand and risks.,0
Tech&cs,Implementation of cloud-based data storage,Increased scalability for businesses,Implementation of cloud-based data storage gives businesses increased scalability for handling data growth.,0
Tech&cs,Increased regulatory scrutiny on social media algorithms,Enhanced transparency in content moderation,Increased regulatory scrutiny on social media algorithms enhances transparency in content moderation across platforms.,0
Tech&cs,Rise in autonomous vehicle technology adoption,Reduction in traffic accidents,Rise in autonomous vehicle technology adoption provides Reduction in traffic accidents.,1
Tech&cs,Expansion of data center infrastructure,Increased energy consumption,Expansion of data center infrastructure increases energy consumption as more servers run continuously.,0
Tech&cs,Adoption of autonomous drones for deliveries,Reduction in human-operated vehicle use,Adoption of autonomous drones for deliveries reduces the need for human-operated vehicles.,0
Tech&cs,Increased reliance on telemedicine,Improved access to healthcare services,Increased reliance on telemedicine improves access to healthcare services for patients in remote locations.,0
Tech&cs,Widespread use of open-source software,Accelerated innovation in technology communities,Widespread use of open-source software accelerates innovation in technology communities through shared development.,0
Tech&cs,Enhanced GPU computational capabilities,Improved performance in AI training tasks,Enhanced GPU computational capabilities improve performance in AI training tasks by speeding up parallel processing.,0
Tech&cs,Increased application of digital twins in manufacturing,Optimized operational efficiency,Increased application of digital twins in manufacturing optimizes operational efficiency by providing real-time system models.,0
Tech&cs,Enhanced encryption standards for mobile devices,Strengthened personal data protection,Enhanced encryption standards for mobile devices strengthen personal data protection against unauthorized access.,0
