"id","cause","effect","raw_response"
"row0","central bank raises interest rates","consumer borrowing decreases","{""""cause"""": """"central bank raises interest rates"""", """"effect"""": """"consumer borrowing decreases""""}"
"row1","the introduction of algorithmic trading strategies","increased volatility in financial markets","{""""cause"""": """"the introduction of algorithmic trading strategies"""", """"effect"""": """"increased volatility in financial markets""""}"
"row2","tightening regulations on cryptocurrency exchanges","reduced market liquidity","{""""cause"""": """"tightening regulations on cryptocurrency exchanges"""", """"effect"""": """"reduced market liquidity""""}"
"row3","increased international trade tariffs","reduction in import-dependent industries' profitability","{""""cause"""": """"increased international trade tariffs"""", """"effect"""": """"reduction in import-dependent industries' profitability""""}"
"row4","the rise in ESG investing standards","growth in sustainable investment funds","{""""cause"""": """"the rise in ESG investing standards"""", """"effect"""": """"growth in sustainable investment funds""""}"
"row5","remote work policies were widely adopted","reduced corporate real estate expenditures occurred","{""""cause"""": """"remote work policies were widely adopted"""", """"effect"""": """"reduced corporate real estate expenditures occurred""""}"
"row6","broader legal shifts","increase in compliance costs for businesses","{""""cause"""": """"broader legal shifts"""", """"effect"""": """"increase in compliance costs for businesses""""}"
"row7","adoption of central bank digital currencies (CBDCs)","cash usage declined","{""""cause"""":""""adoption of central bank digital currencies (CBDCs)"""",""""effect"""":""""cash usage declined""""}"
"row8","escalation of geopolitical tensions emerged","increased prices of commodities such as oil seemed to follow","{""""cause"""": """"escalation of geopolitical tensions emerged"""", """"effect"""": """"increased prices of commodities such as oil seemed to follow""""}"
"row9","rising inflation rates","decreased consumer purchasing power","{""""cause"""": """"rising inflation rates"""", """"effect"""": """"decreased consumer purchasing power""""}"
"row10","growing focus on financial knowledge","increased household savings rates","{""""cause"""": """"growing focus on financial knowledge"""", """"effect"""": """"increased household savings rates""""}"
"row11","growth of fintech lending platforms","improved access to credit for small businesses","{""""cause"""": """"growth of fintech lending platforms"""", """"effect"""": """"improved access to credit for small businesses""""}"
"row12","","","{""""cause"""": """""""", """"effect"""": """"""""}"
"row13","","","{""""cause"""": """""""", """"effect"""": """"""""}"
"row14","reduction in government subsidies for renewable energy","decreased private investment in solar power projects","{""""cause"""": """"reduction in government subsidies for renewable energy"""", """"effect"""": """"decreased private investment in solar power projects""""}"
"row15","ongoing rise in remote banking services","physical bank branches saw a marked decline","{""""cause"""":""""ongoing rise in remote banking services"""",""""effect"""":""""physical bank branches saw a marked decline""""}"
"row16","implementation of carbon taxes","increased operational costs for heavy industries","{""""cause"""": """"implementation of carbon taxes"""", """"effect"""": """"increased operational costs for heavy industries""""}"
"row17","the shift toward AI-driven credit scoring","increased accuracy in loan approvals","{""""cause"""": """"the shift toward AI-driven credit scoring"""", """"effect"""": """"increased accuracy in loan approvals""""}"
"row18","supply chain disruptions amid pandemics","inflationary pressures on consumer goods","{""""cause"""": """"supply chain disruptions amid pandemics"""", """"effect"""": """"inflationary pressures on consumer goods""""}"
"row19","use of blockchain","improved transparency in transactions","{""""cause"""": """"use of blockchain"""", """"effect"""": """"improved transparency in transactions""""}"
"row20","rise in housing market speculation","increased risk of property price bubbles","{""""cause"""": """"rise in housing market speculation"""", """"effect"""": """"increased risk of property price bubbles""""}"
"row21","sanctions","reduction of foreign direct investment","{""""cause"""": """"sanctions"""", """"effect"""": """"reduction of foreign direct investment""""}"
"row22","broader industry changes","rise in corporate mergers and acquisitions","{""""cause"""": """"broader industry changes"""", """"effect"""": """"rise in corporate mergers and acquisitions""""}"
"row23","strengthened regulations in anti-money laundering policies","increased administrative overhead","{""""cause"""": """"strengthened regulations in anti-money laundering policies"""", """"effect"""": """"increased administrative overhead""""}"
"row24","the shift toward digital payment systems accelerated","physical currency circulation declined","{""""cause"""": """"the shift toward digital payment systems accelerated"""", """"effect"""": """"physical currency circulation declined""""}"
"row25","","","{}"
"row26","increased frequency of forest fires in the region","reduction in biodiversity","{""""cause"""": """"increased frequency of forest fires in the region"""", """"effect"""": """"reduction in biodiversity""""}"
"row27","rapid expansion of urban areas","loss of wetlands","{""""cause"""": """"rapid expansion of urban areas"""", """"effect"""": """"loss of wetlands""""}"
"row28","rapid ocean acidification","decreased coral reef resilience","{""""cause"""": """"rapid ocean acidification"""", """"effect"""": """"decreased coral reef resilience""""}"
"row29","adoption of regenerative agriculture practices","increased soil carbon sequestration","{""""cause"""": """"adoption of regenerative agriculture practices"""", """"effect"""": """"increased soil carbon sequestration""""}"
"row30","extensive deforestation in tropical regions","reduction in regional rainfall","{""""cause"""": """"extensive deforestation in tropical regions"""", """"effect"""": """"reduction in regional rainfall""""}"
"row31","elevated currents of increased microplastic pollution","decline in marine life populations","{""""cause"""": """"elevated currents of increased microplastic pollution"""", """"effect"""": """"decline in marine life populations""""}"
"row32","widespread drought conditions","reduced agricultural productivity","{""""cause"""": """"widespread drought conditions"""", """"effect"""": """"reduced agricultural productivity""""}"
"row33","seasons of intensified hurricane activity","increased coastal infrastructure damage","{""""cause"""": """"seasons of intensified hurricane activity"""", """"effect"""": """"increased coastal infrastructure damage""""}"
"row34","melting permafrost in polar regions","atmospheric stations recorded increased methane release","{""""cause"""": """"melting permafrost in polar regions"""", """"effect"""": """"atmospheric stations recorded increased methane release""""}"
"row35","implementation of plastic bag bans","reduction in plastic waste in areas","{""""cause"""": """"implementation of plastic bag bans"""", """"effect"""": """"reduction in plastic waste in areas""""}"
"row36","large-scale adoption of electric vehicles","reduction in urban air pollution on transit corridors","{""""cause"""": """"large-scale adoption of electric vehicles"""", """"effect"""": """"reduction in urban air pollution on transit corridors""""}"
"row37","rising global average temperatures","increased frequency of heatwaves","{""""cause"""": """"rising global average temperatures"""", """"effect"""": """"increased frequency of heatwaves""""}"
"row38","extensive fertilizer runoff from basins","increased eutrophication in aquatic ecosystems downstream","{""""cause"""": """"extensive fertilizer runoff from basins"""", """"effect"""": """"increased eutrophication in aquatic ecosystems downstream""""}"
"row39","enhanced public transportation infrastructure","reduced urban greenhouse gas emissions along corridors","{""""cause"""": """"enhanced public transportation infrastructure"""", """"effect"""": """"reduced urban greenhouse gas emissions along corridors""""}"
"row40","rapid glacial retreat in mountainous regions","reduced freshwater availability","{""""cause"""": """"rapid glacial retreat in mountainous regions"""", """"effect"""": """"reduced freshwater availability""""}"
"row41","expansion of offshore wind farms reached commissioning milestones","increased renewable energy production during fiscal quarters","{""""cause"""": """"expansion of offshore wind farms reached commissioning milestones"""", """"effect"""": """"increased renewable energy production during fiscal quarters""""}"
"row42","increased urban heat islands amid construction","elevated energy consumption for cooling","{""""cause"""": """"increased urban heat islands amid construction"""", """"effect"""": """"elevated energy consumption for cooling""""}"
"row43","development of large-scale solar farms","habitat disruption for wildlife","{""""cause"""": """"development of large-scale solar farms"""", """"effect"""": """"habitat disruption for wildlife""""}"
"row44","severe soil erosion amid intensive agriculture","reduced land productivity","{""""cause"""": """"severe soil erosion amid intensive agriculture"""", """"effect"""": """"reduced land productivity""""}"
"row45","adoption of stringent emissions regulations","reduction in industrial pollution","{""""cause"""": """"adoption of stringent emissions regulations"""", """"effect"""": """"reduction in industrial pollution""""}"
"row46","increased brine discharge","impacting marine ecosystems","{""""cause"""": """"increased brine discharge"""", """"effect"""": """"impacting marine ecosystems""""}"
"row47","increased prevalence of invasive species amid global trade","loss of native species","{""""cause"""": """"increased prevalence of invasive species amid global trade"""", """"effect"""": """"loss of native species""""}"
"row48","expansion of protected marine reserves","recovery of fish populations","{""""cause"""": """"expansion of protected marine reserves"""", """"effect"""": """"recovery of fish populations""""}"
"row49","implementation of urban tree planting programs","mitigation of urban air pollution along participating streets","{""""cause"""": """"implementation of urban tree planting programs"""", """"effect"""": """"mitigation of urban air pollution along participating streets""""}"
"row50","rapid melting of Antarctic ice shelves","acceleration of global sea-level rise","{""""cause"""": """"rapid melting of Antarctic ice shelves"""", """"effect"""": """"acceleration of global sea-level rise""""}"
"row51","","","{}"
"row52","The field of quantum computing is evolving rapidly","new algorithms are being tested for diverse applications","{""""cause"""": """"The field of quantum computing is evolving rapidly"""", """"effect"""": """"new algorithms are being tested for diverse applications""""}"
"row53","the rise of machine learning models that can detect diseases with increasing accuracy","healthcare diagnostics are benefiting","{""""cause"""": """"the rise of machine learning models that can detect diseases with increasing accuracy"""", """"effect"""": """"healthcare diagnostics are benefiting""""}"
"row54","More devices are interconnected","the risk of vulnerabilities in security frameworks remains a significant concern for cybersecurity professionals","{""""cause"""": """"More devices are interconnected"""", """"effect"""": """"the risk of vulnerabilities in security frameworks remains a significant concern for cybersecurity professionals""""}"
"row55","the shift towards remote work","a surge in the use of various collaboration technologies","{""""cause"""": """"the shift towards remote work"""", """"effect"""": """"a surge in the use of various collaboration technologies""""}"
"row56","5G infrastructure's focus on reducing latency","its impact on industries that require minimal communication delays is becoming increasingly evident","{""""cause"""": """"5G infrastructure's focus on reducing latency"""", """"effect"""": """"its impact on industries that require minimal communication delays is becoming increasingly evident""""}"
"row57","The debate around the ethical use of personal data","is shaping public perception and regulatory discussions","{""""cause"""": """"The debate around the ethical use of personal data"""", """"effect"""": """"is shaping public perception and regulatory discussions""""}"
"row58","processing information closer to the source","reduce latency","{""""cause"""": """"processing information closer to the source"""", """"effect"""": """"reduce latency""""}"
"row59","Autonomous vehicle technology reducing human error in driving","potentially lowering traffic accidents","{""""cause"""": """"Autonomous vehicle technology reducing human error in driving"""", """"effect"""": """"potentially lowering traffic accidents""""}"
"row60","Retailers are increasingly turning to augmented reality (AR)","offer immersive shopping experiences","{""""cause"""": """"Retailers are increasingly turning to augmented reality (AR)"""", """"effect"""": """"offer immersive shopping experiences""""}"
"row61","Generative AI tools are gaining ground in content creation","faster production of diverse types of media","{""""cause"""":""""Generative AI tools are gaining ground in content creation"""",""""effect"""":""""faster production of diverse types of media""""}"
"row62","Blockchain technology is being increasingly applied to enhance transparency in supply chains","better tracking of goods","{""""cause"""": """"Blockchain technology is being increasingly applied to enhance transparency in supply chains"""", """"effect"""": """"better tracking of goods""""}"
"row63","Neuromorphic computing mimics the brain’s processes","AI efficiency is improved","{""""cause"""": """"Neuromorphic computing mimics the brain’s processes"""", """"effect"""": """"AI efficiency is improved""""}"
"row64","logistical and cost challenges","hamper widespread adoption","{""""cause"""": """"logistical and cost challenges"""", """"effect"""": """"hamper widespread adoption""""}"
"row65","the need to increase security and streamline user experiences","biometric authentication systems are being implemented across various sectors","{""""cause"""": """"the need to increase security and streamline user experiences"""", """"effect"""": """"biometric authentication systems are being implemented across various sectors""""}"
"row66","the advancement of predictive analytics tools","businesses are better equipped to anticipate market shifts and disruptions in the supply chain","{""""cause"""": """"the advancement of predictive analytics tools"""", """"effect"""": """"businesses are better equipped to anticipate market shifts and disruptions in the supply chain""""}"
"row67","The widespread adoption of cloud storage solutions","opened up new possibilities for businesses seeking to scale efficiently","{""""cause"""": """"The widespread adoption of cloud storage solutions"""", """"effect"""": """"opened up new possibilities for businesses seeking to scale efficiently""""}"
"row68","Regulatory pressures on social media platforms","calls for more transparent content moderation practices","{""""cause"""": """"Regulatory pressures on social media platforms"""", """"effect"""": """"calls for more transparent content moderation practices""""}"
"row69","allowing more flexible control over configurations","transforming network management","{""""cause"""": """"allowing more flexible control over configurations"""", """"effect"""": """"transforming network management""""}"
"row70","The demand for cloud services and digital infrastructure grows","The energy consumption of data centers increases","{""""cause"""": """"The demand for cloud services and digital infrastructure grows"""", """"effect"""": """"The energy consumption of data centers increases""""}"
"row71","the logistical and regulatory challenges associated with large-scale drone operations","raise questions about their widespread adoption","{""""cause"""": """"the logistical and regulatory challenges associated with large-scale drone operations"""", """"effect"""": """"raise questions about their widespread adoption""""}"
"row72","Telemedicine is offering new ways to provide healthcare services","healthcare services can reach remote and underserved populations","{""""cause"""": """"Telemedicine is offering new ways to provide healthcare services"""", """"effect"""": """"healthcare services can reach remote and underserved populations""""}"
"row73","The growth of open-source software","is driving innovation by allowing collaborative development across various tech communities","{""""cause"""": """"The growth of open-source software"""", """"effect"""": """"is driving innovation by allowing collaborative development across various tech communities""""}"
"row74","Graphics processing units (GPUs) have become integral to artificial intelligence training","enabling more efficient computation","{""""cause"""": """"Graphics processing units (GPUs) have become integral to artificial intelligence training"""", """"effect"""": """"enabling more efficient computation""""}"
"row75","their adoption grows","companies are realizing the potential for increased efficiency","{""""cause"""": """"their adoption grows"""", """"effect"""": """"companies are realizing the potential for increased efficiency""""}"
"row76","Data security becomes a higher priority","Mobile devices are adopting stronger encryption methods to safeguard user information","{""""cause"""": """"Data security becomes a higher priority"""", """"effect"""": """"Mobile devices are adopting stronger encryption methods to safeguard user information""""}"
